author,title,rating,ratings,genres,link
О. В. Терентьева,ОГЭ-2024. Английский язык. 30 тренировочных вариантов экзаменационных работ для подготовки к основному государственному экзамену,4.2,5,"ГИА по иностранному языку (ОГЭ, ГВЭ), Задания по английскому языку, Иностранный язык 9 класс, Основной государственный экзамен (ОГЭ), Подготовка к экзаменам, Тесты по английскому языку, Школьные учебники по английскому языку, Экзамен по английскому языку",https://www.litres.ru/book/o-terenteva/oge-2024-angliyskiy-yazyk-30-trenirovochnyh-variantov-ekzamena-69347815/
Жюль Верн,20 тысяч лье под водой,4.8,889,"Детям и родителям, Зарубежная классика, Зарубежная фантастика, Научная фантастика, Подводный мир, Французская литература, Экранизации",https://www.litres.ru/audiobook/zhul-vern/20-tysyach-le-pod-vodoy-292262/
Себастьян Жапризо,Купе смертников,4.4,415,"Загадочные убийства, Зарубежные детективы, Подозреваемые, Французские детективы",https://www.litres.ru/audiobook/sebastyan-zhaprizo/kupe-smertnikov-51266251/
Софья Тимофеева,Бизнес на каблуках. Советы деловой женщины,4.7,14,"Бизнес-идеи, Бизнес-леди, Бизнес-модели, Самиздат, Стартапы и создание бизнеса, Только на ЛитРес",https://www.litres.ru/book/sofya-timofeeva-32086617/biznes-na-kablukah-sovety-delovoy-zhenschiny-67779863/
Джек Д. Швагер,"Таинственные маги рынка. Лучшие трейдеры, о которые вы никогда не слышали",4.8,73,"Инвестиции и инвестирование, Истории успеха, Личные финансы, Трейдинг, Финансовые инвестиции, Фондовый рынок, Ценные бумаги / инвестиции",https://www.litres.ru/audiobook/dzhek-shvager/tainstvennye-magi-rynka-luchshie-treydery-o-kotorye-vy-nikog-67317890/
Бо Со,"Как убедить тех, кого хочется прибить. Правила продуктивного спора без агрессии и перехода на личности",3.8,8,"Деловое общение, Деловые переговоры, Переговоры, Психология общения, Стратегия переговоров, Успешные переговоры, Эффективное общение",https://www.litres.ru/audiobook/bo-seo/kak-ubedit-teh-kogo-hochetsya-pribit-pravila-produktivnogo-spora-be-70107835/
Пауло Коэльо,Одиннадцать минут,4.5,1493,"В поисках счастья, Взросление, Женские судьбы, Любовные испытания, Современная зарубежная литература, Философская проза",https://www.litres.ru/book/paulo-koelo/odinnadcat-minut-122527/
Шамиль Идиатуллин,До февраля,4.4,117,"Психологическая проза, Редакция Елены Шубиной, Серийные убийцы, Современная русская литература, Социальная проза, Тайны прошлого",https://www.litres.ru/book/shamil-idiatullin/do-fevralya-69004540/
Джон Рональд Руэл Толкин,Две твердыни,4.9,162,"«Темный Властелин», Героическое фэнтези, Зарубежное фэнтези, Квест, Классика фэнтези, Спасение мира, Экранизации, Эпическое фэнтези",https://www.litres.ru/book/dzhon-tolkin/dve-tverdyni-67601652/
Сэнди Хотчкисс,Почему всегда дело в тебе? 7 смертных грехов нарциссизма,4.9,9,"Зарубежная психология, Нарциссизм, Практические рекомендации, Психологическая защита, Психотерапия, Психотипы, Эгоизм",https://www.litres.ru/book/sendi-hotchkiss/pochemu-vsegda-delo-v-tebe-7-smertnyh-grehov-narcissizma-69596002/
Анна Шарлай,Психология стиля,4.4,84,"Визуальное восприятие, Женская психология, Мода и стиль, О психологии популярно, Самиздат, Саморазвитие / личностный рост, Стилистика, Только на ЛитРес",https://www.litres.ru/book/anna-sharlay/psihologiya-stilya-65862323/
Дина Рубина,Наполеонов обоз. Книга 1. Рябиновый клин,4.4,3005,"Высокие чувства, Истории о любви, Книги о любви, Предательство, Современная русская литература",https://www.litres.ru/book/dina-rubina/napoleonov-oboz-kniga-1-ryabinovyy-klin-37660644/
Майк Омер,Дом страха,4.6,803,"Зарубежные детективы, Криминальные драмы, Мировой бестселлер, Остросюжетная литература, Психологические триллеры, Серийные убийцы, Современные детективы, Триллеры",https://www.litres.ru/book/mayk-omer/dom-straha-68678432/
Софья Ремез,"Заметки Гоши Куницына, ученика 4 «А» класса",4.6,109,"Веселые приключения, Детская дружба, Детская проза, Книги для подростков, Позитивный настрой, Семейное чтение, Школьная жизнь",https://www.litres.ru/book/sofya-remez/zametki-goshi-kunicyna-uchenika-4-a-klassa-63315018/
Абрахам Вергезе,Рассечение Стоуна,4.8,861,"Повороты судьбы, Проза жизни, Психологические романы, Современная зарубежная литература",https://www.litres.ru/book/abraham-vergeze/rassechenie-stouna-19038244/
А.Никл,Повелитель теней 5,4.9,21,"Боевое фэнтези, Веселые приключения, Древние боги, ЛитРес: чтец, Магические академии, Магические миры, Попаданцы, Самиздат",https://www.litres.ru/audiobook/a-nikl/povelitel-teney-5-70281958/
Вадим Зеланд,Тафти жрица 2. Управление событиями,4.8,224,"Духовные практики, Практическая эзотерика, Психотехники, Саморазвитие / личностный рост, Скрытые возможности, Транссерфинг, Управление судьбой, Эзотерика / оккультизм",https://www.litres.ru/audiobook/vadim-zeland/tafti-zhrica-2-upravlenie-sobytiyami-69364057/
Билл Любанович,Простой Python. Современный стиль программирования,4.3,32,"Библиотека программиста, Зарубежная компьютерная литература, Информационные технологии (IT), Компьютерные технологии, Программирование, Разработка приложений, Язык Python",https://www.litres.ru/book/b-lubanovich/prostoy-python-sovremennyy-stil-programmirovaniya-64073626/
Михай Чиксентмихайи,Поток: Психология оптимального переживания,4.6,1911,"Вдохновение, Зарубежная психология, Искусство быть счастливым, Общая психология, Практические рекомендации, Психология успеха, Саморазвитие / личностный рост, Счастье",https://www.litres.ru/audiobook/mihay-chiksentmihayi/potok-psihologiya-optimalnogo-perezhivaniya-6653349/
Пег Стрип,Нелюбимая дочь. Как оставить в прошлом травматичные отношения с матерью и начать новую жизнь,4.4,650,"Взаимоотношения в семье, Детская психология, Зарубежная психология, Материнство, Психология личности, Психология отношений, Самопомощь, Саморазвитие / личностный рост, Семейная психология",https://www.litres.ru/book/peg-strip/nelubimaya-doch-kak-ostavit-v-proshlom-travmatichnye-otnosheniya-42817984/
Хэл Элрод,Магия утра. Как первый час дня определяет ваш успех,4.3,9119,"Зарубежная психология, Искусство быть счастливым, Как стать успешным, Личная эффективность, Работа над собой, Развитие личности, Саморазвитие / личностный рост, Скрытые возможности",https://www.litres.ru/book/hel-elrod/magiya-utra-kak-pervyy-chas-dnya-opredelyaet-vash-uspeh-19063017/
Лена Обухова,Пробуждение куклы,4.9,1783,"Загадочная гибель, Загадочные события, Мистика, Мистические детективы, Смертельная опасность, Современные детективы, Частное расследование",https://www.litres.ru/book/lena-obuhova/probuzhdenie-kukly-61254752/
Алекс Д,Улей. Книга 2,4.9,1459,"Жестокие игры, Остросюжетная проза, Остросюжетные любовные романы, Тайные общества, Триллеры, Эксперименты над людьми, Эротические романы, Эротический триллер",https://www.litres.ru/book/aleks-d-17618839/uley-kniga-2-69247255/
Дмитрий Глуховский,Метро. Трилогия под одной обложкой,4.5,1844,"Антиутопия, Близкое будущее, Мутанты, Психологическая фантастика, Социальная фантастика, Умирающая Земля",https://www.litres.ru/book/dmitriy-gluhovskiy/metro-trilogiya-pod-odnoy-oblozhkoy-22764358/
Анджей Сапковский,Последнее желание,4.9,2871,"Боевое фэнтези, Героическое фэнтези, Зарубежное фэнтези, Интриги, Квест, Книги про волшебников, Магические способности, Сражения, Становление героя",https://www.litres.ru/audiobook/andzhey-sapkovskiy/poslednee-zhelanie-63454836/
Евгений Щепин,"ВкусВилл: Как совершить революцию в ритейле, делая всё не так",4.7,1013,"Истории успеха, Личный опыт, Просто о бизнесе, Ритейл, Российская практика, Сетевая розничная торговля, Стартапы и создание бизнеса, Успешный бизнес",https://www.litres.ru/book/evgeniy-schepin-2114/vkusvill-kak-sovershit-revoluciu-v-riteyle-delaya-vse-39436936/
Евгений Щепин,"ВкусВилл: Как совершить революцию в ритейле, делая всё не так",4.8,985,"Истории успеха, Краткое изложение, Личный опыт, Просто о бизнесе, Ритейл, Российская практика, Сетевая розничная торговля, Стартапы и создание бизнеса, Успешный бизнес",https://www.litres.ru/audiobook/evgeniy-schepin-2114/vkusvill-kak-sovershit-revoluciu-v-riteyle-delaya-vse-39442826/
Максим Батырев,Менеджмент во время шторма. 15 правил управления в кризис,4.6,97,"Антикризисное управление, Деловая карьера, Кризисное управление, Лидерство, Менеджмент, Менеджмент и кадры, Организация рабочего процесса, Теория менеджмента, Эффективное руководство",https://www.litres.ru/book/maksim-batyrev/menedzhment-vo-vremya-shtorma-15-pravil-upravleniya-v-krizi-67939511/
Леонид Юзефович,Дом свиданий,4.5,161,"Загадочное исчезновение, Исторические детективы, Российская империя, Русский сыск, Убийства",https://www.litres.ru/audiobook/leonid-uzefovich/dom-svidaniy-42598148/
Александра Маринина,Дебютная постановка. Том 1,4.7,906,"Журналистское расследование, Загадочные события, Загадочные убийства, Расследование преступлений, Современные детективы, Частные детективы",https://www.litres.ru/audiobook/aleksandra-marinina/debutnaya-postanovka-tom-1-69549202/
Татьяна Устинова,Развод и девичья фамилия,5.0,2,"Загадочные убийства, Остросюжетные любовные романы, Повороты судьбы, Современные детективы, Частное расследование",https://www.litres.ru/audiobook/tatyana-ustinova/razvod-i-devichya-familiya-70272025/
Дем Михайлов,Перекресток одиночества 4. Часть 1,4.8,86,"Антиутопия, Боевая фантастика, Борьба за выживание, Детективная фантастика, Опасные приключения, Параллельные миры, Попаданцы, Сверхспособности",https://www.litres.ru/audiobook/dem-mihaylov/perekrestok-odinochestva-4-chast-1-70201285/
Джулия Либур,Дракон с бантиком,5.0,155,"Городское фэнтези, Дружба, Магия и волшебство, Новогодние сказки, Романтическое фэнтези, Русское фэнтези, Самиздат, Фэнтези про драконов",https://www.litres.ru/book/dzhuliya-libur/drakon-s-bantikom-70088254/
Алексей Пехов,Цветок яблони,4.9,2208,"Боевое фэнтези, Волшебные миры, Героическое фэнтези, Квест, Книги про волшебников, Магические артефакты, Сверхспособности, Становление героя",https://www.litres.ru/book/aleksey-pehov/cvetok-yabloni-68446993/
Фрэнк Кинслоу,Мгновенное исцеление. Техника Квантового Смещения,4.7,45,"Биоэнергетика, Воздействие на сознание, Духовные практики, Здоровье, Оздоровительные системы, Пошаговые инструкции, Практическая эзотерика, Эзотерика / оккультизм",https://www.litres.ru/book/frenk-kinslou/mgnovennoe-iscelenie-tehnika-kvantovogo-smescheniya-68704485/
Евгений Севастьянов,Системное управление на практике. 50 историй из опыта руководителей для развития управленческих навыков,4.7,150,"Лидерство, Менеджмент организации, Организационный менеджмент, Психология в бизнесе, Российская практика, Руководителям организаций и предприятий, Саморазвитие / личностный рост, Управление бизнесом, Управление персоналом, Успешный бизнес, Эффективное руководство",https://www.litres.ru/audiobook/evgeniy-sevastyanov/sistemnoe-upravlenie-na-praktike-50-istoriy-iz-opyta-r-66610714/
Михаил Дорин,Авиатор: назад в СССР 2,4.5,29,"Альтернативная история, Военная авиация, Историческая фантастика, Книги о приключениях, Назад в СССР, Перемещение во времени, Попаданцы, Самиздат",https://www.litres.ru/book/mihail-dorin-32876272/aviator-nazad-v-sssr-2-70239646/
Маргарита Ардо,Академия волшебства. Незачет по злодеям,4.8,1299,"Волшебство, Драконы, Книги про волшебников, Любовное фэнтези, Любовные приключения, Магические академии, Магические способности, Приключенческое фэнтези",https://www.litres.ru/book/margarita-ardo/akademiya-volshebstva-nezachet-po-zlodeyam-69348256/
Анна Марчук,"Хитрый, как лис, ловкий, как тигр. 36 китайских стратагем, которые научат выходить победителем из любой ситуации",4.7,64,"Восточная мудрость, Древневосточная литература, Древнекитайская философия, Как достичь успеха, Личная эффективность, Психологическое воздействие, Саморазвитие / личностный рост, Техники влияния",https://www.litres.ru/book/anna-marchuk-3160472/hitryy-kak-lis-lovkiy-kak-tigr-36-kitayskih-stratagem-66587286/
Андрей Васильев,Останний день,4.9,3574,"Авантюрные приключения, Городское фэнтези, Квест, Магические миры, Приключенческое фэнтези, Становление героя",https://www.litres.ru/book/andrey-vasilev-4/ostanniy-den-65391731/
Роб Янг,Сила личности. Как влиять на людей и события,3.7,45,"Лидерство, Личная эффективность, Мотивация, Развитие личности, Саморазвитие / личностный рост, Техники влияния",https://www.litres.ru/book/rob-yang/sila-lichnosti-kak-vliyat-na-ludey-i-sobytiya-11080175/
Патрик Кинг,"Как стать экспертом по человеческому поведению. Наблюдайте, читайте, понимайте и расшифровывайте людей на основе минимальной информации",4.4,16,"Личная эффективность, Поведенческая психология, Работа над собой, Саморазвитие / личностный рост, Самосовершенствование, Эффективное общение",https://www.litres.ru/book/patrik-king/kak-stat-ekspertom-po-chelovecheskomu-povedeniu-nabludayte-chi-67922682/
Фредрик Бакман,Вторая жизнь Уве,4.9,8605,"Жизненные ценности, Психологическая проза, Современная зарубежная литература, Философская проза, Шведская литература, Экранизации",https://www.litres.ru/audiobook/fredrik-bakman/vtoraya-zhizn-uve-24414722/
Ася Володина,Протагонист,4.7,199,"Детективное расследование, Загадочная смерть, Загадочное самоубийство, Испытания, Психологическая проза, Современная русская литература, Триллеры",https://www.litres.ru/book/asya-volodina/protagonist-69152536/
Мишель Бюсси,Ты никогда не исчезнешь,4.5,21,"Загадочное исчезновение, Зарубежные детективы, Мистические детективы, Психологические детективы, Современные детективы, Тайны прошлого, Французские детективы",https://www.litres.ru/audiobook/mishel-bussi/ty-nikogda-ne-ischeznesh-70243618/
Ерофей Трофимов,Одиночка,4.6,2141,"Альтернативная история, Боевая фантастика, Борьба за выживание, Другое тело, Историческая фантастика, Попаданцы, Русско-турецкая война, Становление героя",https://www.litres.ru/book/erofey-trofimov/odinochka-66891128/
Наталья Мамлеева,"Истинная для демона-2, или Укради мои воспоминания",4.9,936,"Любовное фэнтези, Любовные интриги, Любовные приключения, Магические миры, Приключенческое фэнтези, Эпическое фэнтези",https://www.litres.ru/book/natalya-mamleeva/istinnaya-dlya-demona-2-ili-ukradi-moi-vospominaniya-69650512/
Светлана Гурьянова,"В начале было кофе. Лингвомифы, речевые «ошибки» и другие поводы поломать копья в спорах о русском языке",5.0,52,"История языков, Лингвистика, Лингвистический анализ, Научно-популярная литература, Речеведение, Русский язык, Современный русский язык, Языкознание",https://www.litres.ru/book/svetlana-guryanova/v-nachale-bylo-kofe-lingvomify-rechevye-oshibki-i-drugi-69730168/
Кира Иствуд,Отбор Истинных. Книга 2. Второй шанс для принцессы,4.9,1134,"Детективное фэнтези, Любовное фэнтези, Любовные интриги, Магические способности, Оборотни, Опасные приключения, Попаданцы, Самиздат",https://www.litres.ru/book/kira-istvud-32078339/otbor-istinnyh-kniga-2-vtoroy-shans-dlya-princessy-67925177/
Юлия Ефимова,Пока медведица на небе,4.8,645,"Детектив-загадка, Женские детективы, Иронические детективы, Ироничная проза, Классические детективы, Остросюжетные любовные романы, Приключенческие детективы, Самиздат",https://www.litres.ru/book/uliya-efimova-17531856/poka-medvedica-na-nebe-48409367/
Кира Иствуд,Возвращение злодейки любовного романа,4.9,974,"Любовное фэнтези, Магические способности, Мистические детективы, Оборотни, Попаданцы, Придворные интриги, Самиздат",https://www.litres.ru/book/kira-istvud-32078339/vozvraschenie-zlodeyki-lubovnogo-romana-67894244/
Джордж Сэмюэль Клейсон,Самый богатый человек в Вавилоне,4.8,16170,"Богатство, Зарубежная деловая литература, Зарубежная психология, Исполнение желаний, Как достичь успеха, Личная эффективность, Личные финансы, Притчи, Саморазвитие / личностный рост, Финансовое благополучие",https://www.litres.ru/book/dzhorzh-semuel-kleyson/samyy-bogatyy-chelovek-v-vavilone-23593618/
Андрей Курпатов,Красная таблетка. Посмотри правде в глаза,4.4,7490,"Анатомия и физиология человека, Иллюзии жизни, Научно-популярная литература, Нейропсихология, Самопознание, Саморазвитие / личностный рост, Советы психолога, Счастье",https://www.litres.ru/audiobook/andrey-kurpatov/krasnaya-tabletka-posmotri-pravde-v-glaza-38268036/
Ханья Янагихара,Маленькая жизнь,4.5,3864,"Жизненные трудности, Мировой бестселлер, Психологическая проза, Современная зарубежная литература, Судьба человека, Тайны прошлого",https://www.litres.ru/book/hanya-yanagihara/malenkaya-zhizn-22061261/
Виктор Пелевин,KGBT+ (КГБТ+),4.5,2333,"Антиутопия, Далёкое будущее, Жизненный выбор, Жизнь после смерти, Постмодернизм, Современная русская литература",https://www.litres.ru/audiobook/viktor-pelevin/kgbt-kgbt-68010761/
