author,title,rating,ratings,genres,link
Юлия Пирумова,"Хрупкие люди. Почему нарциссизм – это не порок, а особенность, с которой можно научиться жить",4.8,702,"Повышение самооценки, Практическая психология, Психологические тренинги, Самопознание, Саморазвитие / личностный рост, Самосовершенствование, Советы психолога, Уверенность в себе",https://www.litres.ru/book/uliya-pirumova/hrupkie-ludi-pochemu-narcissizm-eto-ne-porok-a-osobennost-s-51806817/
Александр Баунов,Конец режима. Как закончились три европейские диктатуры,4.5,194,"Диктатура, Историческая литература, История Европы, Политическая публицистика, Политические лидеры, Популярно об истории, Публицистика",https://www.litres.ru/book/aleksandr-baunov/konec-rezhima-kak-zakonchilis-tri-evropeyskie-diktatury-68775138/
Вадим Зеланд,Трансерфинг реальности. Ступень I: Пространство вариантов,4.8,8667,"Исполнение желаний, Практическая эзотерика, Самопознание, Саморазвитие / личностный рост, Самосовершенствование, Скрытые возможности, Управление судьбой, Эзотерика / оккультизм",https://www.litres.ru/audiobook/vadim-zeland/transerfing-realnosti-stupen-i-prostranstvo-variantov-175711/
Антон Петряков,Быть нельзя казаться,4.7,189,"Личная эффективность, Принятие решений, Работа над собой, Самопознание, Саморазвитие / личностный рост, Состояния и явления психики, Человеческий мозг, Человеческий разум",https://www.litres.ru/book/anton-petryakov/byt-nelzya-kazatsya-68708445/
Катерина Ленгольд,"Agile life: Как вывести жизнь на новую орбиту, используя методы agile-планирования, нейрофизиологию и самокоучинг",4.6,138,"Мотивация, Осознанность, Привычка, Саморазвитие / личностный рост, Успех, Эффективность",https://www.litres.ru/audiobook/katerina-lengold/agile-life-kak-vyvesti-zhizn-na-novuu-orbitu-ispolzuya-me-67274058/
Валерий Увалов,Стальные Волки. Сектор заражения,4.7,93,"Боевая фантастика, Боевые роботы, Выживание человечества, Инопланетное вторжение, Космическая фантастика, Научная фантастика, Самиздат, Становление героя",https://www.litres.ru/audiobook/valeriy-uvalov/stalnye-volki-sektor-zarazheniya-69975655/
Влад Лей,Старатель 3,4.6,116,"Боевая фантастика, Боевики, Космическая фантастика, Космические приключения, Космос, Остросюжетная фантастика, Самиздат, Фантастический боевик",https://www.litres.ru/book/vlad-ley-32542360/staratel-3-69500620/
Влад Лей,Старатель 2,4.5,115,"Боевая фантастика, Боевики, Космическая фантастика, Космос, Остросюжетная фантастика, Приключенческая фантастика, Самиздат, Фантастический боевик",https://www.litres.ru/book/vlad-ley-32542360/staratel-2-69430381/
Эдвард Бернейс,Кристаллизация общественного мнения,4.0,13,"PR, Воздействие на сознание, Зарубежная деловая литература, Манипуляция массовым сознанием, Общественное мнение, Пропаганда, Техники влияния",https://www.litres.ru/book/edvard-berneys/kristallizaciya-obschestvennogo-mneniya-65368792/
Влад Лей,Старатель 7,5.0,46,"Боевая фантастика, Книги о приключениях, Космическая фантастика, Космические приключения, Космос, Остросюжетная фантастика, Самиздат, Фантастический боевик",https://www.litres.ru/book/vlad-ley-32542360/staratel-7-70226497/
Серж Винтеркей,Антидемон. Книга 6,4.7,693,"Боевое фэнтези, Книги про волшебников, Колдовство, Магические способности, Попаданцы, Путешествия во времени, Сражения, Становление героя",https://www.litres.ru/book/serzh-vinterkey/antidemon-kniga-6-69529486/
Серж Винтеркей,Антидемон. Книга 7,4.8,713,"Боевое фэнтези, Книги про волшебников, Колдовство, Магические способности, Попаданцы, Путешествия во времени, Сражения, Становление героя",https://www.litres.ru/book/serzh-vinterkey/antidemon-kniga-7-69611299/
Ная Геярова,Академия Драконесс. Восход теней,4.8,120,"Любовное фэнтези, Магические миры, Приключенческое фэнтези, Романтическое фэнтези, Фэнтези про драконов",https://www.litres.ru/book/naya-geyarova/akademiya-drakoness-voshod-teney-69906646/
Филип Котлер,Основы маркетинга,4.3,291,"Брендинг, Зарубежная деловая литература, Маркетинг, Маркетинговые стратегии, Привлечение клиентов",https://www.litres.ru/book/filip-kotler/osnovy-marketinga-8912433/
Хэл Элрод,Магия утра. Как первый час дня определяет ваш успех,4.5,6614,"Зарубежная психология, Искусство быть счастливым, Как стать успешным, Личная эффективность, Развитие личности, Режим дня, Саморазвитие / личностный рост, Скрытые возможности",https://www.litres.ru/audiobook/hel-elrod/magiya-utra-kak-pervyy-chas-dnya-opredelyaet-vash-uspeh-26898060/
Александр Богачев,"Графики, которые убеждают всех",2.5,2,"Визуализация, Графический дизайн, Инфографика, Статистика, Эффективная презентация",https://www.litres.ru/book/aleksandr-bogachev/grafiki-kotorye-ubezhdaut-vseh-70244374/
Маргулан Сейсембай,Миссия выполнима. Технология счастливой жизни,4.7,86,"Как достичь успеха, Как обрести счастье, Мотивация, Мотивация и личность, Мотивация работников, Психология успеха",https://www.litres.ru/book/margulan-seysembay/missiya-vypolnima-tehnologiya-schastlivoy-zhizni-69284500/
Мэттью Перри,"Друзья, любимые и одна большая ужасная вещь",5.0,28,"Автобиографии, Биографии артистов, Биографии и мемуары, Жизненный путь, Зарубежная публицистика, Исповедь, Истории из жизни, Личная жизнь знаменитостей",https://www.litres.ru/audiobook/mettu-perri/druzya-lubimye-i-odna-bolshaya-uzhasnaya-vesch-70184026/
Anne Dar,Абсолютный. Часть 1. Парадизар,5.0,2706,"Антиутопия, Боевая фантастика, Борьба за выживание, Героическая фантастика, Остросюжетная фантастика, Самиздат, Сила духа, Триллеры",https://www.litres.ru/book/anne-dar/absolutnyy-chast-1-paradizar-69208228/
Дэвид Аллен,Как привести дела в порядок: искусство продуктивности без стресса,4.2,829,"Личная эффективность, Организация рабочего процесса, Планирование, Саморазвитие / личностный рост, Тайм-менеджмент, Технологии успеха, Эффективность",https://www.litres.ru/book/devid-allen/kak-privesti-dela-v-poryadok-iskusstvo-produktivnosti-bez-stre-4436330/
Энн Пэтчетт,Голландский дом,4.6,1040,"Бестселлеры «New York Times», Историческая литература, Превратности судьбы, Психологическая проза, Семейная сага, Современная зарубежная литература, Философская проза",https://www.litres.ru/book/enn-petchett/gollandskiy-dom-66368172/
Ася Казанцева,Кто бы мог подумать!,4.5,1288,"Издательство Corpus, Интересные факты, Логическое мышление, Научно-популярная литература, Нервная система, Общая биология, Общая психология, Прочая образовательная литература, Тайны памяти",https://www.litres.ru/book/asya-kazanceva/kto-by-mog-podumat-6568003/
Станислав Дробышевский,"Дело о пропавшей учительнице, или Параллельные человечества палеолита",4.9,98,"Антропология, Детская познавательная и развивающая литература, Детская фантастика, Детские детективы, Детские приключения, Загадочные происшествия, Иллюстрированное издание, Невероятные приключения, Происхождение человечества, Расследование",https://www.litres.ru/book/masha-rupasova/delo-o-propavshey-uchitelnice-ili-parallelnye-chelovechestv-66583884/
Роберт Гловер,"Хватит быть славным парнем! Проверенный способ добиться желаемого в любви, сексе и жизни",4.8,1302,"Зарубежная прикладная литература, Зарубежная психология, Как стать успешным, Практическая психология, Преодоление проблем, Психология успеха, Работа над собой, Саморазвитие / личностный рост, Самосовершенствование",https://www.litres.ru/audiobook/robert-glover/hvatit-byt-slavnym-parnem-proverennyy-sposob-dobitsya-zhelae-24082898/
Роман Прокофьев,Звездная кровь-3. Земли теней,4.9,1112,"LitRPG, Боевая фантастика, Героическое фэнтези, Киберпанк, Постапокалипсис, Становление героя, Техномагия, Технофэнтези",https://www.litres.ru/book/roman-urevich-prokofev/zvezdnaya-krov-3-zemli-teney-69269257/
Нассим Николас Талеб,Антихрупкость. Как извлечь выгоду из хаоса,4.6,1266,"Анализ рисков, Бизнес-издания, Зарубежная деловая литература, Как достичь успеха, Мировая экономика, Непредсказуемость, Риски, Экономическая политика",https://www.litres.ru/audiobook/nassim-nikolas-taleb/antihrupkost-kak-izvlech-vygodu-iz-haosa-36309932/
Павел Басинский,Подлинная история Константина Левина,4.7,3,"Анализ художественных произведений, Иллюстрированное издание, Книги и чтение, Литературоведение, Научно-популярная литература, Редакция Елены Шубиной, Филологический анализ",https://www.litres.ru/book/pavel-basinskiy/podlinnaya-istoriya-konstantina-levina-70029094/
Клайв Стейплз Льюис,Хроники Нарнии. Вся история Нарнии в 7 повестях,5.0,28,"Героическое фэнтези, Детская фантастика, Детское фэнтези, Зарубежное фэнтези, Зарубежные детские книги, Книги про волшебников, Магическое фэнтези, Параллельные миры, Приключенческое фэнтези, Эпическое фэнтези",https://www.litres.ru/audiobook/klayv-luis/hroniki-narnii-vsya-istoriya-narnii-v-7-povestyah-69759154/
Евгений Водолазкин,Авиатор,4.5,5759,"Жизненные ценности, Потеря памяти, Премия «Большая книга», Редакция Елены Шубиной, Современная русская литература, Эксперименты над людьми",https://www.litres.ru/book/evgeniy-vodolazkin/aviator-18910175/
Тимофей Кармацкий,"Доказательная психосоматика: факты и научный подход. Очень полезная книга для всех, кто думает о здоровье",4.6,287,"Альтернативная медицина, Болезни и способы их лечения, Здоровье, Здоровье без лекарств, Оздоровительные системы, Популярно о медицине, Практические рекомендации, Человеческий организм",https://www.litres.ru/book/timofey-karmackiy/dokazatelnaya-psihosomatika-fakty-i-nauchnyy-podhod-oche-69200770/
Стивен Кинг,Стрелок,4.5,1977,"Вампиры, Героическое фэнтези, Зарубежное фэнтези, Параллельные миры, Путешествия во времени, Спасение мира, Экранизации",https://www.litres.ru/book/stiven-king/strelok-122201/
Джен Синсеро,"НИ ЗЯ. Откажись от пагубных слабостей, обрети силу духа и стань хозяином своей судьбы",4.4,166,"Зарубежная психология, Как достичь успеха, Личная эффективность, Личный опыт, Мировой бестселлер, Мотивация, Практическая психология, Самопознание, Саморазвитие / личностный рост, Самосовершенствование",https://www.litres.ru/book/dzhen-sinsero/ni-zya-otkazhis-ot-pagubnyh-slabostey-obreti-silu-duha-i-sta-64045706/
Садхгуру,Внутренняя инженерия. Путь к радости. Практическое руководство от йога,4.7,1261,"Асаны, Восточные практики, Здоровье без лекарств, Йога, Личная эффективность, Саморазвитие / личностный рост, Самосовершенствование, Скрытые возможности",https://www.litres.ru/audiobook/sadhguru-15158695/vnutrennyaya-inzheneriya-put-k-radosti-prakticheskoe-ruk-36972504/
Татьяна Устинова,Пленница,4.1,438,"В поисках истины, Интриги, Остросюжетные детективы, Современные детективы, Судебный процесс, Юридические детективы",https://www.litres.ru/book/tatyana-ustinova/plennica-69415819/
Матильда Старр,Школа чернокнижников. Тёмная метка,4.8,2018,"Young adult, Детективное фэнтези, Любовное фэнтези, Любовные интриги, Любовные испытания, Магические академии, Магические способности, Приключенческое фэнтези, Романтическое фэнтези",https://www.litres.ru/book/matilda-starr/shkola-chernoknizhnikov-temnaya-metka-67598586/
Роберт Торогуд,Смерть на Темзе,4.3,161,"Загадочное исчезновение, Зарубежные детективы, Мировой бестселлер, Расследование преступлений, Современные детективы",https://www.litres.ru/book/robert-torogud/smert-na-temze-67136991/
Матильда Старр,Школа чернокнижников. Абсолютный артефакт,4.8,3590,"Young adult, Детективное фэнтези, Любовно-фантастические романы, Любовное фэнтези, Любовные интриги, Любовные испытания, Магические академии, Магические способности, Приключенческое фэнтези, Романтическое фэнтези",https://www.litres.ru/book/matilda-starr/shkola-chernoknizhnikov-absolutnyy-artefakt-66255424/
Виктор Державин,Агентурная разведка. Часть 5. Подсказки интуиции,4.9,149,"Внешняя разведка, Войны, Исторические приключения, Книги о приключениях, Разведка, Самиздат, Шпионские детективы, Шпионы",https://www.litres.ru/book/viktor-derzhavin/agenturnaya-razvedka-chast-5-podskazki-intuicii-68816379/
митрополит Тихон (Шевкунов),«Несвятые святые» и другие рассказы,4.9,1237,"Автобиографическая проза, Биографии и мемуары, Духовная литература, Духовные поиски, Жизненные ценности, Жизненный выбор, Истории из жизни, Православие, Путь к Богу, Христианство",https://www.litres.ru/book/arhimandrit-tihon-shevkunov/nesvyatye-svyatye-i-drugie-rasskazy-48894372/
Ерофей Трофимов,Кровь на клинке,4.8,666,"Альтернативная история, Боевая фантастика, Борьба за выживание, Другое тело, Историческая фантастика, Перемещение во времени, Попаданцы, Спецназ",https://www.litres.ru/book/erofey-trofimov/krov-na-klinke-69856405/
Кэтрин Бэннер,Дом на краю ночи,4.7,4088,"Зарубежные бестселлеры, Зарубежные любовные романы, Легенды и предания, Магический реализм, Романтическая проза, Семейная сага",https://www.litres.ru/book/ketrin-benner/dom-na-krau-nochi-24615144/
Анджей Сапковский,Ведьмак,4.5,204,"Боевое фэнтези, Героическое фэнтези, Драконы, Зарубежное фэнтези, Интриги, Квест, Книги про волшебников, Оборотни, Эльфы",https://www.litres.ru/audiobook/andzhey-sapkovskiy/vedmak-67078200/
Серж Винтеркей,Ревизор: возвращение в СССР 5,4.8,373,"Альтернативная история, Дружба, Назад в СССР, Попаданцы, Расследование",https://www.litres.ru/book/serzh-vinterkey/revizor-vozvraschenie-v-sssr-5-69508441/
Бен Элтон,Два брата,4.8,2113,"Жизненные ценности, Литература Великобритании, Повороты судьбы, Семейные истории, Современная зарубежная литература, Фашизм",https://www.litres.ru/book/ben-elton-2/dva-brata-6524974/
Сергей Лукьяненко,Предел,4.8,5285,"Внеземные цивилизации, Галактические войны, Искусственный интеллект, Космическая фантастика, Космические путешествия, Научная фантастика",https://www.litres.ru/book/sergey-lukyanenko/predel-65061217/
Элияху Голдратт,Цель-2. Дело не в везении,4.7,412,"Бизнес-романы, Зарубежная деловая литература, Как достичь цели, Просто о бизнесе, Развитие бизнеса, Эффективность бизнеса",https://www.litres.ru/book/eliyahu-goldratt/cel-2-delo-ne-v-vezenii-7709166/
Майк Омер,Пламя одержимости,4.9,678,"Заложники, Зарубежные детективы, Полицейские детективы, Психологические триллеры, Расследование преступлений, Секты, Смертельная опасность, Современные детективы, Триллеры",https://www.litres.ru/audiobook/mayk-omer/plamya-oderzhimosti-69651364/
Сосэки Нацумэ,Ваш покорный слуга кот,4.4,177,"Зарубежная классика, Ироничная проза, Классическая проза, Кошки, Литература 20 века, Сатира, Юмор и сатира, Японская литература",https://www.litres.ru/audiobook/soseki-nacume/vash-pokornyy-sluga-kot-59638203/
Фредрик Бакман,Мы против вас,4.8,2318,"Мировой бестселлер, Противостояние, Психологическая проза, Современная зарубежная литература, Социальная проза, Шведская литература",https://www.litres.ru/book/fredrik-bakman/my-protiv-vas-48585766/
Лоретта Грациано Бройнинг,"Гормоны счастья. Как приучить мозг вырабатывать серотонин, дофамин, эндорфин и окситоцин",4.4,2017,"Зарубежная образовательная литература, Зарубежная прикладная литература, Зарубежная психология, Искусство быть счастливым, Научно-популярная литература, Позитивный настрой, Практические рекомендации, Саморазвитие / личностный рост, Самосовершенствование, Эмоции",https://www.litres.ru/book/loretta-broyning/gormony-schastya-kak-priuchit-mozg-vyrabatyvat-serotonin-21136251/
Роберт Грин,Законы человеческой природы,4.8,120,"Зарубежная психология, Зарубежная публицистика, Межличностные коммуникации, О психологии популярно, Психология общения, Психология отношений, Работа над собой, Самопознание, Саморазвитие / личностный рост, Социальная психология",https://www.litres.ru/audiobook/robert-grin/zakony-chelovecheskoy-prirody-66647068/
Карл Сьюэлл,Клиенты на всю жизнь,4.6,1307,"Зарубежная деловая литература, Менеджмент и кадры, Отношения с клиентами, Привлечение клиентов, Просто о бизнесе, Увеличение прибыли, Эффективное руководство",https://www.litres.ru/book/karl-suell/klienty-na-vsu-zhizn-256032/
Ирина Якутенко,Воля и самоконтроль: Как гены и мозг мешают нам бороться с соблазнами,4.5,324,"Научно-популярная литература, Научные исследования, Нейробиология, Патологические зависимости, Психология личности, Человеческий мозг",https://www.litres.ru/book/irina-yakutenko-1266/volya-i-samokontrol-kak-geny-i-mozg-meshaut-nam-borot-27450576/
Джолин Харт,"Год внимания к себе. 365 практик, которые сделают хороший отдых частью жизни",5.0,5,"В поисках мечты, Душевное равновесие, Как достичь цели, Медитации, Методы мотивации, Мотивация, Саморазвитие / личностный рост",https://www.litres.ru/book/jolene-hart/god-vnimaniya-k-sebe-365-praktik-kotorye-sdelaut-horoshiy-otdy-70107508/
